utterance,intent
I'd like to see homes with at least a 100-foot long garden in Essex.,search_properties
"The current tenants are leaving early, so the flat is 'Available Now'. Please update the listing.",update_listing
Show me all waterfront properties in Salford Quays.,search_properties
"What five-bedroom houses are for sale in Hale, Greater Manchester?",search_properties
Create a short description for a 2-bed granite tenement flat in central Aberdeen.,generate_property_description
Can you make me an enticing social media post about a starter home in Walthamstow?,generate_property_description
Find the estimated renovation cost for the fixer-upper in Glasgow.,get_property_details
Generate an article explaining 'restrictive covenants' and how they can affect a property owner.,generate_blog_post
Create a post explaining what a 'Deed of Trust' is and when you need one.,generate_blog_post
The sellers want to add 'Potential to extend (STPP)' to the property details in Guildford.,update_listing
Show me homes with countryside views in rural Yorkshire.,search_properties
Create an article titled: 'How to Save for a Deposit in London'.,generate_blog_post
"I need a place with a designated parking spot, not just on-street parking, in central Brighton.",search_properties
Tell me the projected capital growth for the property in East London.,get_property_details
Draft a guide to selling a property that requires major renovation.,generate_blog_post
How many bedrooms does the property in Richmond have?,get_property_details
