utterance,intent
Draft text for a stunning barn conversion in Herefordshire with several acres of land.,generate_property_description
What do you have that's a penthouse with direct lift access in Birmingham?,search_properties
What's for sale in the 'Toast Rack' area of Wandsworth Common?,search_properties
"Probate has been granted for the house in York, please change its status to 'Available'.",update_listing
"Increase the monthly rent for the Canary Wharf rental to £2,200.",update_listing
"Correct the property description, it's a 'Juliette balcony' not a full balcony, for the flat in Brighton.",update_listing
My client is interested in anything with equestrian facilities in West Sussex.,search_properties
Is the property in a flood risk zone?,get_property_details
What was the feedback from the surveyor on the previous failed sale?,get_property_details
Draft a description for a freehold parcel of woodland for sale in Herefordshire.,generate_property_description
"The parking is allocated, not just 'off-street'. Please make that correction.",update_listing
Create a guide on moving out smoothly after you've sold your property.,generate_blog_post
Generate a blog post: 'A First-Time Buyer's Guide to Using the UK's Property Portals Effectively'.,generate_blog_post
What was the name of the couple who viewed the property twice last week?,get_property_details
"Generate an article explaining the different types of estate agency contracts (sole agency, multi-agency).",generate_blog_post
Get me a summary of all viewing feedback for the home in Reading.,get_property_details
"I need a description for a canal-side apartment in Copenhagen, Denmark.",generate_property_description
Create the text for a 1930s semi-detached house in a suburb of Leicester.,generate_property_description
Write a guide to preparing your garden for property viewings.,generate_blog_post
The available date has been pushed back to August 15th for the rental in Manchester.,update_listing
Can you check the grammar in the main description for the Bath property? I think there are some errors.,update_listing
Show me all listings in the Golden Triangle of Norwich.,search_properties
"I need a short, professional description for a commercial unit in Birmingham's business district.",generate_property_description
Write a blog post for first-time buyers: 'A Glossary of Must-Know Property Terms'.,generate_blog_post
Show me the key log for the property at 34 Elderflower Lane.,get_property_details
Show me the council tax band for the bungalow in Cornwall.,get_property_details
"Write a description for a designer apartment in Knightsbridge, furnished by a renowned interior designer.",generate_property_description
Find me a house with a large kitchen-diner in Bristol.,search_properties
I need a property within a 5-minute walk of a good coffee shop in Manchester's Northern Quarter.,search_properties
Are there any properties with a concierge service in central London?,search_properties
What are the nearest pubs and restaurants to the property in Notting Hill?,get_property_details
What was the previous sale price for the house in Oxford?,get_property_details
Change the furnishing status to 'Unfurnished' for the property on Old Kent Road.,update_listing
Has the property been down-valued by a surveyor in the past?,get_property_details
Pull up the key features for the home in Newcastle.,get_property_details
Quick description needed for a 1-bed retirement flat in Bristol.,generate_property_description
Create a blog post on 'How to Find and Vet a Good Tenant'.,generate_blog_post
Create a post discussing the resilience of the prime central London rental market.,generate_blog_post
Generate a complete guide to getting a mortgage in the UK.,generate_blog_post
What's the nearest large supermarket to the house in rural Yorkshire?,get_property_details
Find the managing agent's details for the block in Manchester City Centre.,get_property_details
Generate a blog post analyzing the Autumn 2025 property market forecast for the North West.,generate_blog_post
Are there any twilight or evening photos of the property?,get_property_details
How many second viewings are booked for the flat in Angel?,get_property_details
Show me the full viewing history for the property at 12 Grimmauld Place.,get_property_details
"The sellers have accepted an offer, but want it marketed as 'Under Offer' while we check the chain.",update_listing
Generate text for a property that has recently been fully refurbished to a high standard.,generate_property_description
"Generate a property description for a 4-bedroom detached house in Harpenden with a large, south-facing garden.",generate_property_description
Can you write a Facebook post for a new property on the market? It's a bungalow in Bournemouth.,generate_property_description
"The EPC rating for the Glasgow flat is C, please update the listing.",update_listing
"Generate a description for a Georgian townhouse in Bath, focusing on its restored period features.",generate_property_description
"The owner will be away, so add 'No viewings between August 10th and 20th' to the agent notes.",update_listing
Show me all the properties being marketed by Savills in Surrey.,search_properties
Who is the agent covering the next viewing at the Winchester property?,get_property_details
Is the vendor's solicitor on the lender panel for HSBC?,get_property_details
I need a flat that is close to the Northern Line.,search_properties
What's on the market in Shrewsbury with four or more bedrooms?,search_properties
I need the raw image files from the photographer for the listing in Bath.,get_property_details
Add the room dimensions to the listing for the Bristol home.,update_listing
Analyze the trend of 'downsizing' among retirees and its effect on the housing market.,generate_blog_post
Write a piece on the effect of changing EPC regulations on the rental market.,generate_blog_post
"Is there a wood-burning stove, and is it certified?",get_property_details
"Write a description for a modern, high-spec apartment in Birmingham's Jewellery Quarter.",generate_property_description
Find me a home with a south-facing garden in Winchester.,search_properties
Create a brochure entry for a new development of high-tech business units.,generate_property_description
Write the blurb for a new instruction: a 5-bed executive home in Alderley Edge.,generate_property_description
I want to see listings that have a virtual tour available in Manchester.,search_properties
Create a guide for pet owners on how to prepare their home for viewings.,generate_blog_post
Show me the proximity of the property to the M25 motorway.,get_property_details
Can I see all the photos for the property on Regent Street?,get_property_details
Add 'Off-street parking' to the features for the Brighton house.,update_listing
What are the access arrangements for the communal areas of the building?,get_property_details
What three-bed semi-detached homes are available near Jesmond Dene in Newcastle?,search_properties
Show me the date the property was first listed for sale.,get_property_details
Can you pull up the service charge accounts for the last 3 years for the flat in Battersea?,get_property_details
Generate a blog post on how to negotiate with developers when buying a new build.,generate_blog_post
Get me the sales history going back 20 years for the address in Kensington.,get_property_details
Compose a post on the future of high street retail spaces and their potential for residential conversion.,generate_blog_post
Change the rental term to 'Long term let only (12 months minimum)' for the house in Cambridge.,update_listing
What's for sale on the Isle of Wight with a sea view?,search_properties
"The landlord will now consider pets, please add 'Pets considered' to the listing in Islington.",update_listing
I need a property with disabled access in Bath.,search_properties
Update the listing for the Chelsea flat: the building is managed by 'Kinleigh Folkard & Hayward'.,update_listing
Search for properties with direct access to a park or common.,search_properties
Display the full EPC report for the flat in Brighton.,get_property_details
I'm looking for a top-floor flat in a Victorian conversion in Bristol.,search_properties
"Give me a draft for a 1-bed ex-local authority flat in Bethnal Green, London. Focus on the value.",generate_property_description
Are there any thatched cottages for sale in Dorset?,search_properties
Update the tenure information: 'Share of Freehold with an underlying lease of 987 years'.,update_listing
Get me the dimensions of the garage for the house in Milton Keynes.,get_property_details
Change the letting type to 'Student Let' for the property near the University of Nottingham.,update_listing
Find me a detached home with five bedrooms in the Richmond area.,search_properties
I'm looking for a property with a westerly-facing garden for evening sun.,search_properties
Display all viewing requests that are currently awaiting confirmation.,get_property_details
"I'm looking for a studio flat near a tube station in Zone 2, London.",search_properties
Generate a romantic and evocative description for a thatched cottage in a Dorset village.,generate_property_description
Describe a 4-bedroom house in Solihull. Make it sound perfect for a growing family.,generate_property_description
Find me a house that has a stream or river at the bottom of the garden.,search_properties
Write a post on the emotional and psychological aspects of selling a family home.,generate_blog_post
Are there any subletting restrictions on the apartment in Canary Wharf?,get_property_details
Update the status of the bungalow in Cornwall to Sold STC.,update_listing
Tell me the size of the garden for the cottage in Devon.,get_property_details
Show me the condition report from the survey on the house in Exeter.,get_property_details
What's a good way to describe a modern apartment near Temple Meads station in Bristol?,generate_property_description
Create a blog post discussing the pros and cons of buying off-plan properties.,generate_blog_post
I need a description that highlights the low service charge for a purpose-built flat in Coventry.,generate_property_description
"Draft a description for a large, open-plan office floor in a building in Leeds city centre.",generate_property_description
Has an environmental search been completed for the home in Manchester?,get_property_details
"Show me properties under £500,000 in Brighton and Hove.",search_properties
What is the walking distance to the nearest train station from the house in Guildford?,get_property_details
I need your help writing a description. It's for a one-bed flat in Hackney that needs a quick sale.,generate_property_description
"A virtual tour is now available for the City Centre apartment, please link it to the listing.",update_listing
What have you got in the £400k-£450k price bracket in York?,search_properties
Write an article on 'How to Price Your Home Realistically in a Slow Market'.,generate_blog_post
Can you reorder the photos for the Sheffield listing? I want the kitchen to be picture number two.,update_listing
Pull up the service charge breakdown for the penthouse in Liverpool.,get_property_details
Show me homes with a 'smart home' system already installed.,search_properties
Show me the status of the property chain above our buyer.,get_property_details
Find a property within the M25 with at least 4 bedrooms and a garden for under £1m.,search_properties
Draft a blog post on 'Selling Inherited Property: A Step-by-Step Guide'.,generate_blog_post
Is there a utility room in the property with reference #P8876?,get_property_details
Draft a description for a large agricultural barn with potential for Class Q permitted development.,generate_property_description
I need to block out viewing times for this Friday morning for a deep clean.,get_property_details
"The seller wants to knock £5,000 off the asking price for the house in Leicester.",update_listing
"Can you change the status for the flat on Deansgate, Manchester to 'Exchanged'?",update_listing
"Create a short description for a 2-bed terraced house in Cardiff, perfect for first-time buyers.",generate_property_description
Generate a blog post on 'Shared Ownership: Is it the Right Choice for You?',generate_blog_post
Write a description for a waterfront apartment in Ipswich with potential mooring rights.,generate_property_description
"Generate a description for a new build home in a development outside Cambridge, highlighting the commuter links to London.",generate_property_description
"Generate a listing for a terraced house with views of the castle in Conwy, Wales.",generate_property_description
"Create a detailed description for a flat within a prestigious mansion block in Maida Vale, London.",generate_property_description
Are there any apartments with access to a residents' lounge in Birmingham?,search_properties
Show me homes with a 'walk-in wardrobe' in the master bedroom.,search_properties
Generate an analysis on the impact of Build-to-Rent schemes on the private rental market.,generate_blog_post
Make a description for a flat that's small but in a prime location in central London.,generate_property_description
Is the property eligible for any first-time buyer schemes?,get_property_details
"Draft a description for a pet-friendly apartment building in Leeds, mentioning the nearby parks.",generate_property_description
Are there any riverside properties available in Richmond upon Thames?,search_properties
Find a property that's close to a good primary school in North London.,search_properties
"The vendors sent over some better pictures for the Sheffield house, can you update them?",update_listing
Draft a post on the best commuter villages with direct trains to Manchester Piccadilly.,generate_blog_post
Add the new lifestyle photos to the end of the gallery for the farmhouse in Devon.,update_listing
Create a market update for Q3 2025 for the Home Counties.,generate_blog_post
"Create a description for a top-floor apartment in a new development in Finnieston, Glasgow.",generate_property_description
What cottages are for sale in the Lake District?,search_properties
Write a premium listing for a country estate in the Surrey Hills with a swimming pool and tennis court.,generate_property_description
"Please reflect a price change on the Brighton maisonette, the new asking price is £550,000.",update_listing
What's the highest offer received to date for the house on Elm Street?,get_property_details
Display all feedback received for the cottage in the Lake District.,get_property_details
"Draft an analysis of the property market in Northern Ireland, highlighting key growth areas.",generate_blog_post
"Compose a luxury property description for a mansion in St George's Hill, Weybridge.",generate_property_description
What's the asking price per square foot for the loft in Manchester?,get_property_details
Has the price changed for the property on Baker Street?,get_property_details
Compose a guide to selling a home with unconventional features or a unique history.,generate_blog_post
"Is the property currently tenanted, and if so, what are the tenancy details?",get_property_details
Create a post exploring the market for retirement properties in the UK.,generate_blog_post
Search for properties that are 'back on the market' in the Bath area.,search_properties
Are there any semi-detached houses with at least 3 bedrooms in Southampton?,search_properties
Update the main image for the listing on Ocean Drive to the one with the sea view.,update_listing
The seller wants to specify 'No smokers' on the listing for the Bristol flat.,update_listing
I'm looking for a ground floor maisonette in Brighton with a private garden.,search_properties
Show me farmhouses with land in the Peak District.,search_properties
Draft a post explaining the 'sealed bids' process and how to create a winning bid.,generate_blog_post
"Find a house in a village near Oxford, budget is around £800k.",search_properties
"The landlord has now agreed to pets, so please remove the 'No Pets' clause from the listing.",update_listing
"Draft an ad for a 5-bedroom townhouse in Edinburgh's New Town, focusing on its Georgian architecture.",generate_property_description
"Adjust the price of the flat in Leicester to £175,000. The seller is motivated.",update_listing
Find all properties for sale on the banks of the River Thames in Berkshire.,search_properties
"Draft the marketing text for a newly designed smart home in Sandbanks, Poole.",generate_property_description
Change the property type to 'Maisonette' as it has its own private entrance.,update_listing
Struggling with the words for a remote cottage in Snowdonia. Can you help?,generate_property_description
Show me the fixtures and fittings list (TA10) for the house in Exeter.,get_property_details
Show me all properties within a 20-minute walk of the city centre in York.,search_properties
Pull up a list of everyone who has viewed the property in SoHo.,get_property_details
"Create the text for a studio apartment in Brighton, noting its close proximity to The Lanes and the seafront.",generate_property_description
Draft a description that highlights the peace and quiet of a rural property in the Peak District.,generate_property_description
I need a brochure description for a historic manor house for sale in Oxfordshire with extensive grounds.,generate_property_description
Find me a one-bedroom flat with a balcony in Liverpool's Baltic Triangle.,search_properties
Change the pricing strategy for the land in Kent to 'Price on Application'.,update_listing
Generate a post on 'Budgeting for the Hidden Costs of Buying a Home'.,generate_blog_post
Write about how to check for common problems like damp and subsidence during a viewing.,generate_blog_post
How many years are left on the lease for the apartment in Mayfair?,get_property_details
"Draft the copy for a house needing modernisation in Bearwood, Birmingham.",generate_property_description
Create a guide on how to choose the right estate agent to sell your home.,generate_blog_post
"The vendors for the Manchester property have accepted an offer, can you update the listing?",update_listing
Write me a description for a modern family home on the outskirts of Belfast.,generate_property_description
Show me the viewing schedule for the house on Holly Lane this week.,get_property_details
"I'm looking for something quirky, like a windmill or a water tower conversion.",search_properties
Show me the interactive site map for the new development in Cambridge.,get_property_details
Write a blog post on planning permission: When do you need it?,generate_blog_post
What is the total square footage of the flat in Salford Quays?,get_property_details
Draft a description for a property that is being sold with no onward chain.,generate_property_description
Search for properties that accept offers in the region of £300k in Leeds.,search_properties
Update the bullet points for the Canary Wharf apartment to include '24-hour concierge'.,update_listing
Show me properties with an en-suite bathroom for every bedroom in Northwood.,search_properties
Create a description for a single garage for sale in a residential area of Hove.,generate_property_description
Draft an article explaining the 'Right to Rent' checks for landlords.,generate_blog_post
"The floor plan for the Manchester apartment is wrong, please delete it and I'll upload a corrected version tomorrow.",update_listing
Get me the details of the nearest NHS doctor's surgery and if they are accepting patients.,get_property_details
Draft me something for a period conversion flat in Tunbridge Wells.,generate_property_description
Write a description for a large apartment in a beautiful crescent in Bath.,generate_property_description
"I need a house that isn't overlooked from the back, in a quiet part of Reading.",search_properties
Show me the viewing calendar for the property on Victoria Street.,get_property_details
Update the tenure to 'Leasehold' and add the remaining lease years: '95 years remaining'.,update_listing
Compose an article on the growing trend of multi-generational living and its effect on the housing market.,generate_blog_post
"Find all homes for sale in Clifton Village, Bristol.",search_properties
Write a blog post titled: 'A Mid-Year Review: The UK Property Market in July 2025'.,generate_blog_post
Write an article on the perks of riverside living along the Thames.,generate_blog_post
"The seller has provided the utility costs, please add a note in the agent section: 'Average gas & electric £150pcm'.",update_listing
Is the loft boarded for storage?,get_property_details
Compose a piece on how to market a unique or unusual property effectively.,generate_blog_post
Are there any homes available with a wine cellar?,search_properties
"Write a listing for a small, lock-up shop unit in a busy suburban parade.",generate_property_description
Generate a description for a three-storey Victorian townhouse in the golden triangle of Norwich.,generate_property_description
"Generate an article on marketing your home in the digital age, beyond the main property portals.",generate_blog_post
Generate a description that makes a studio apartment sound spacious and cleverly designed.,generate_property_description
I'm looking for a barn conversion in the Cotswolds.,search_properties
What kind of bungalows are for sale in Suffolk?,search_properties
Draft a description for a large family home in a sought-after part of Solihull.,generate_property_description
"The tenant at the rental property has requested no more viewings this week, please block out the calendar.",update_listing
Create an Instagram caption for a new luxury listing we have in Belgravia.,generate_property_description
Get me information on local council planning applications near the house in Esher.,get_property_details
What are the vendor's preferred viewing times for the property in St Albans?,get_property_details
The sellers have confirmed the tenure is Freehold for the house in Solihull.,update_listing
I'm looking for a family home in the catchment for Altrincham Grammar School.,search_properties
Generate an article that demystifies Japanese Knotweed and its impact on getting a mortgage.,generate_blog_post
Compose an article on the pros and cons of offering a 'pet-friendly' rental property.,generate_blog_post
"The tenants at the Manchester property require 48 hours' notice, please add this to the notes.",update_listing
"Find me a detached bungalow in Norfolk, it must be chain-free.",search_properties
Pull up the offer that was accepted for the house in Surrey.,get_property_details
I need the estimated monthly utility costs for the terraced house in Bristol.,get_property_details
"Text for Zoopla listing: 4 bed townhouse, Greenwich, London, in a secure gated development.",generate_property_description
Write a blog post titled: '10 Cost-Effective Ways to Add Value to Your Home Before Selling'.,generate_blog_post
Generate a listing for a retail unit with a prime high street location in Chester.,generate_property_description
Analyse the impact of new build developments on property prices in suburban areas.,generate_blog_post
Generate a guide on how to sell a property that's part of a complex property chain.,generate_blog_post
Can you get me the notes from last Saturday's open house in Balham?,get_property_details
I need to see all upcoming appointments for the property with reference ABC123.,get_property_details
Is the property located on a flight path?,get_property_details
Can you confirm the number of bathrooms in the townhouse on George Street?,get_property_details
I need the business rates if the property in Birmingham is used commercially.,get_property_details
Show me retirement properties in Bournemouth.,search_properties
Was there any specific feedback on road noise from people who viewed the property?,get_property_details
Compose a piece analyzing the demand for properties with dedicated home offices.,generate_blog_post
"Write a listing for a rustic 'finca' (country estate) in Mallorca, Spain.",generate_property_description
The landlord is supplying a new washing machine; please add this to the list of included appliances.,update_listing
Generate a blog post exploring the demand for holiday lets in Cornwall and Devon.,generate_blog_post
Who are the solicitors handling the sale for the property on Elm Street?,get_property_details
Draft a post comparing the lifestyle in South London vs. North London.,generate_blog_post
Show me everything that was reduced in price last week in the whole of Kent.,search_properties
"The property falls under a conservation area, please add this detail to the listing.",update_listing
"The house on Elm Street, Manchester is now sold.",update_listing
"The key for the flat in Liverpool is now with us, so we can change viewing access to 'Key in office'.",update_listing
Can you replace the main image of the Liverpool flat with the one showing the balcony view?,update_listing
I need a description for a converted church in Norfolk with original stained-glass windows.,generate_property_description
Generate an article explaining the concept of 'rental yield' and which UK cities offer the best returns.,generate_blog_post
Generate a description for a live/work unit in Hackney Wick.,generate_property_description
Are there any homes for sale with access to a communal gym and pool in Salford?,search_properties
Create a description that focuses purely on the investment yield for a property near a major hospital.,generate_property_description
Create an article on the financial benefits of decluttering and staging your home before listing.,generate_blog_post
Make me a description for a 2-bedroom pre-war apartment on New York's Upper West Side.,generate_property_description
Generate a description for a property with a large loft space with potential for conversion.,generate_property_description
