utterance,intent
I need to see the aerial drone footage of the estate in Cheshire.,get_property_details
"Write an article explaining different mortgage types: Fixed, Tracker, and Variable.",generate_blog_post
Search for all homes listed this week in the SW19 postcode.,search_properties
Show me properties with a large conservatory in the Southampton area.,search_properties
Write a description for a house with an impressive south-facing garden in Leicester.,generate_property_description
Display the stamp duty calculation for the list price of the property on King's Road.,get_property_details
Are there any new flats on the market in the B1 postcode?,search_properties
I need a short and sweet description for an Instagram post about a charming cottage in Cornwall.,generate_property_description
I need a description for a retirement bungalow in a quiet community in Norwich.,generate_property_description
Create an article on landlord insurance: What it covers and why you need it.,generate_blog_post
Generate a luxury listing for an apartment in Manchester's Beetham Tower.,generate_property_description
I need a bungalow with at least two bedrooms in Lincoln.,search_properties
Draft a description for a home with off-street parking for multiple cars in central Cambridge.,generate_property_description
Search for apartments in buildings that are known for their architecture in Manchester.,search_properties
"Upload the video tour for the property at 99 Redcliffe Square, London.",update_listing
Tell me about the local gym and leisure facilities near the apartment in Salford.,get_property_details
"The open house for the Bristol property is now fully booked, please add a note 'Open house fully booked, reserve list only'.",update_listing
Write a comprehensive seller's checklist for completion day.,generate_blog_post
Draft a post on how to negotiate a house price after a bad survey report.,generate_blog_post
Show me the window and door specifications from the brochure.,get_property_details
Tell me the predicted rental yield for the apartment in Birmingham.,get_property_details
Create a guide to understanding your property's Energy Performance Certificate (EPC) and how to improve it.,generate_blog_post
Generate a post on the benefits of getting a 'Mortgage in Principle' before you start house hunting.,generate_blog_post
I want a property that has been featured in a design magazine.,search_properties
"Create marketing copy for a new beachfront apartment complex in Lisbon, Portugal.",generate_property_description
Does the property have a south-facing garden?,get_property_details
Write an article on the benefits of investing in HMO (House in Multiple Occupation) properties.,generate_blog_post
Show me the total number of days on market for the property in Harrogate.,get_property_details
Who from our office currently holds the keys for the flat in Richmond?,get_property_details
Add to the rental in Shoreditch: 'The property has access to a communal gym and roof terrace'.,update_listing
Write a description for a split-level maisonette in Clapham with its own private entrance.,generate_property_description
Has there been any interest from cash buyers for the property in Oxford?,get_property_details
What is the make and model of the boiler in the house in Sheffield?,get_property_details
Write a guide to buying with a partner: Joint Tenants vs. Tenants in Common.,generate_blog_post
Draft an article on the growing popularity of eco-friendly new builds among buyers.,generate_blog_post
Generate an elegant description for a duplex penthouse in Canary Wharf with 24-hour concierge.,generate_property_description
Are there any viewings scheduled for tomorrow for the property on Park Lane?,get_property_details
Draft a lifestyle guide to living in the Peak District National Park.,generate_blog_post
Are there any outstanding service charge arrears on the flat in Islington?,get_property_details
Search for penthouses in Manchester with a roof terrace.,search_properties
Find me an apartment in a building with a residents' gym in Leeds.,search_properties
Are there any planned major construction projects in the immediate area?,get_property_details
Write a blog post on how to handle tenancy disputes and evictions legally.,generate_blog_post
"The current front shot is terrible, can you replace it with the twilight photo for the listing in Chelsea?",update_listing
What was John Smith's feedback on the Birmingham property?,get_property_details
"We need to adjust the price for the house in Bath to reflect the recent survey findings; the new price is £580,000.",update_listing
Does the lease for the flat in Chelsea allow for pets?,get_property_details
I'm looking for a two-bedroom cottage in a quiet village in Suffolk.,search_properties
"Let's set up a second open house for the house in Guildford for this Sunday, same times.",update_listing
How long has the house in Wimbledon been listed?,get_property_details
Draft a post on the pros and cons of using a letting agent vs. self-managing.,generate_blog_post
Generate an article on the importance of professional property photography.,generate_blog_post
Create a blog post on how to identify up-and-coming areas for buy-to-let investment.,generate_blog_post
Show me a log of all price reductions for the property in Chester.,get_property_details
Is the property vacant or owner-occupied at present?,get_property_details
"I've just uploaded new professional photos for the Manchester penthouse, please make them live.",update_listing
Show me homes in the Cotswolds that have been on the market for more than three months.,search_properties
"Find me a modern, open-plan apartment in Canary Wharf.",search_properties
Write a post on 'Open House vs. Private Viewings: Which is Better for Your Property?',generate_blog_post
Draft an ad for a large apartment in a converted mill in Bradford's Little Germany.,generate_property_description
Generate text for a Zoopla listing: a Grade II listed weavers' cottage in Macclesfield.,generate_property_description
Generate a compelling description for a one-bedroom garden flat in Fulham.,generate_property_description
Add this sentence to the description of the Windsor property: 'The property benefits from a south-facing garden.',update_listing
List all properties within a 10-minute drive of Heathrow Airport.,search_properties
Search for properties that are being sold via shared ownership in Bristol.,search_properties
Write about the long-term property investment outlook for cities along the HS2 route.,generate_blog_post
Need ad copy for a retirement property in a managed complex in Eastbourne.,generate_property_description
List all homes for sale in the school catchment area for St. Peter's School in Exeter.,search_properties
"Change the number of bathrooms from 1 to 2 for the property on Church Road, Bristol.",update_listing
Add a note to the listing in Southampton: 'Cash buyers only'.,update_listing
Create a seller's guide to navigating a 'buyer's market' successfully.,generate_blog_post
When was the property last sold?,get_property_details
Generate a description for a waterfront villa in Cornwall with private beach access.,generate_property_description
Draft a guide for 'accidental landlords' and what they need to know.,generate_blog_post
Show me a list of all viewers who subsequently made an offer.,get_property_details
I need the EPC rating for the house we viewed in Cambridge.,get_property_details
What's available in Newcastle upon Tyne for first-time buyers?,search_properties
Pull up the contact number for the current tenant to arrange a viewing.,get_property_details
Create a guide to the best London boroughs for green spaces.,generate_blog_post
Are there any properties with a separate studio or workshop in the garden in Brighton?,search_properties
What are the materials of the kitchen countertops in the flat in Soho?,get_property_details
Write a description for a Victorian conversion flat that retains original fireplaces and cornicing.,generate_property_description
"The seller wants to be clear, add 'Sold as seen' to the property notes.",update_listing
Are there any homes with a swimming pool in Cheshire?,search_properties
I want to see new build developments in Reading.,search_properties
Search for properties that come with a tenanted contract in place in Liverpool.,search_properties
I'm interested in period terraced houses in Islington.,search_properties
Compose an article on the legal process of transferring ownership on completion day.,generate_blog_post
Is the price negotiable on the house in Canterbury?,get_property_details
Find out about the local residents' association for the estate in Dulwich.,get_property_details
Are there any apartments in Liverpool with floor-to-ceiling windows?,search_properties
"Write me a description for a student let, 4 bedrooms, fully furnished, near the University of Nottingham.",generate_property_description
Find all homes within the boundary of Dartmoor National Park.,search_properties
"Drop the price of the flat in Islington by £25,000.",update_listing
Find a flat that is on the top floor but not a penthouse in a modern block in Leeds.,search_properties
Update the viewing instructions for the property in Leeds: '24 hours notice required'.,update_listing
Search for homes within a 2-mile radius of Reading station.,search_properties
Draft a post on the home improvements with the best Return on Investment for 2025.,generate_blog_post
Create an article explaining the legal paperwork involved in selling a house in England.,generate_blog_post
"The deal on the Edinburgh apartment has collapsed, please relist it.",update_listing
Generate a post explaining Capital Gains Tax for property sellers.,generate_blog_post
What's the council tax for a single occupant at the property in York?,get_property_details
I need a pet-friendly two-bed flat with some outdoor space in Edinburgh.,search_properties
Can I see the Matterport scan for the flat in Manchester?,get_property_details
Find me a property with good natural light and high ceilings in Edinburgh's New Town.,search_properties
"The owner has just renewed the lease, please update the description to reflect '990 years remaining'.",update_listing
Write a description for a 1-bed flat that needs to sell fast. Make it sound like a bargain.,generate_property_description
Need some text for a window card. It's a 2-bed terrace in Sheffield.,generate_property_description
"I need a description for a terraced house in the popular area of Southville, Bristol.",generate_property_description
Write a description for a Grade I listed oast house for sale in Kent.,generate_property_description
Add 'Viewings to commence from the 5th of August' to the listing details for the York property.,update_listing
Please add the drone footage to the gallery for the farmhouse in Wales.,update_listing
"Delete photo number 5 for the Brighton seafront property, it's out of date.",update_listing
Tell me about the nightlife and noise levels in the area around the Shoreditch flat.,get_property_details
Search for a property with an annex or separate living space in Kent.,search_properties
"The sale on 42 Primrose Lane, Harrogate has collapsed, put it back on the market as 'Available'.",update_listing
"Could you draft a property description for a coastal home in Sydney, Australia, with ocean views?",generate_property_description
Add 'Fibre optic broadband available' to the key features of the property in Salford.,update_listing
Create the marketing text for a large industrial warehouse to let near Heathrow Airport.,generate_property_description
Describe a cottage in the Cotswolds. Emphasize 'cozy' and 'charming'.,generate_property_description
How would you describe a penthouse with a wraparound terrace in Leeds city centre?,generate_property_description
Find a three-bed semi-detached house in the suburbs of Birmingham.,search_properties
Draft a description that emphasizes the 'hidden gem' quality of a mews house in South Kensington.,generate_property_description
Find any properties listed for auction in Sheffield.,search_properties
Pull up all listings in Harrogate with original period features.,search_properties
Who is the vendor for the property with reference #GHI456?,get_property_details
Search for houses for sale on Cotham Road in Bristol.,search_properties
Is the property in an Ultra Low Emission Zone (ULEZ)?,get_property_details
"The property on Willow Lane, York is now pending completion.",update_listing
"The house in Windsor needs a price adjustment, new price is £1,200,000.",update_listing
What's on the market in Notting Hill for around £2 million?,search_properties
Find a flat with a service charge of less than £2000 per year in London Zone 3.,search_properties
Display the property's social media post and its engagement stats.,get_property_details
"The landlord of the Oxford flat will now include council tax and water for an increased rent of £1400pcm, update please.",update_listing
Show me apartments in a converted warehouse in Shoreditch.,search_properties
Find all listings in the historic town of Windsor.,search_properties
Give me a punchy opening line for a warehouse conversion listing in Shoreditch.,generate_property_description
"Need a description for a new build apartment in Salford Quays, highlighting the EWS1 certificate.",generate_property_description
I need to sell a Martello tower on the Suffolk coast. Write a suitably historic and unique description.,generate_property_description
"I've sent you the link to the drone video, please embed it on the listing for the estate in Cheshire.",update_listing
I need a property with land suitable for keeping chickens or a smallholding.,search_properties
"Describe this property for me: 2 beds, ground floor, private patio, right next to Wandsworth Common.",generate_property_description
"Write a professional description for a modern office space for lease in Spinningfields, Manchester.",generate_property_description
Play the video tour for the flat in Canary Wharf.,get_property_details
"I'm looking for something with character, maybe an old schoolhouse or chapel conversion.",search_properties
Add the new twilight photos to the listing for the house in Harrogate.,update_listing
Write a post on how to conduct a professional property inventory.,generate_blog_post
"Draft the copy for a lakeside lodge in the Lake District, emphasizing its holiday let potential.",generate_property_description
Create a guide for buyers on how to perform due diligence on a property's history and planning.,generate_blog_post
"Put the bungalow in Bournemouth back on, the buyer couldn't secure a mortgage.",update_listing
Display any known upcoming assessments or major works costs for the block in Brighton.,get_property_details
Let's write a description for a houseboat on a canal in Amsterdam.,generate_property_description
"The brochure is now ready, can you upload the PDF to the listing for the house in Harrogate?",update_listing
Change the listing for the house in Cambridge to 'Furnished'.,update_listing
"Create a description for a property with stunning, uninterrupted sea views in Devon. Make this the main focus.",generate_property_description
"Show me all homes for sale on King Street, Cambridge.",search_properties
Write a description for a semi-detached house in a Dublin suburb.,generate_property_description
Search for properties that have planning permission granted for an extension in Hertford.,search_properties
Can you reduce the price on the Newcastle apartment by 5%?,update_listing
I want to find a fixer-upper project in East London.,search_properties
"Change 45 King's Avenue, Cardiff to 'Under Offer'.",update_listing
I need the contact details for the people who viewed the Battersea flat yesterday.,get_property_details
I'm stuck. Can you write a punchy description for a student studio near a London university?,generate_property_description
Show me all homes for sale in the village of Painswick in the Cotswolds.,search_properties
I need a property with a driveway that can accommodate a caravan or motorhome.,search_properties
Generate an article explaining the difference between 'exchange' and 'completion'.,generate_blog_post
Create a description for a luxury apartment in a high-rise in Singapore.,generate_property_description
Add a block viewing event for the Clapham flat next Tuesday between 5pm and 7pm.,update_listing
Search for homes with low council tax bands in the Chester area.,search_properties
"Generate a description for a flat perfect for remote work, highlighting the dedicated office space.",generate_property_description
Create a guide to 'biophilic design': bringing nature into your home to boost its appeal.,generate_blog_post
Compose a compelling description for a property with a home cinema and gym in Chelsea.,generate_property_description
I want to find a three-bedroom house that's been recently refurbished in Cardiff.,search_properties
"The landlord has withdrawn the rental in Notting Hill, please remove the listing.",update_listing
Generate an article titled 'Leasehold vs. Freehold: A Buyer's Guide'.,generate_blog_post
Show me homes with a secure bike storage facility in Cambridge.,search_properties
The ground rent for the Reading flat escalates; please add the details from the lease I emailed.,update_listing
Show me listings with a '3D tour' option in the Nottingham area.,search_properties
"Correct the description for the Sheffield flat; it's electric heating, not gas central heating.",update_listing
Are there any homes with a roof terrace that has views of the London skyline?,search_properties
The vendor has instructed a price drop on the Exeter property to get it sold before the end of the month.,update_listing
"The seller wants to be aggressive; change the price for the Liverpool apartment to 'Offers Over £150,000'.",update_listing
"Need to advertise a room for rent in a shared house in Brighton. Write me a short, friendly ad.",generate_property_description
Let's move the Leeds warehouse listing to 'Under Offer'.,update_listing
Show me the marketing brochure for the penthouse on the South Bank.,get_property_details
"The vendor wants to pause viewings, can you mark the listing as 'Temporarily Unavailable'?",update_listing
Create a post comparing the property markets in Manchester vs. Birmingham for young professionals.,generate_blog_post
Find me a Victorian terraced house in the Moseley area of Birmingham.,search_properties
Search for a family home with a playroom or a second reception room.,search_properties
Find the property on the Environment Agency's flood map.,get_property_details
Add a note to the rental listing in Clapham: 'A six-month break clause is available'.,update_listing
Generate a blog post on property auction trends for Q3 2025.,generate_blog_post
I'm looking for a Georgian townhouse in Bath.,search_properties
"Is there an alarm system at the property in Hampstead, and what's the code?",get_property_details
"Generate a punchy, energetic description for a first-time buyer flat in Brixton.",generate_property_description
"Write a listing for a two-bed flat in Clifton, Bristol, emphasizing its balcony views over the suspension bridge.",generate_property_description
Generate a blog post on 'How to spot a property with good 'bones' and investment potential'.,generate_blog_post
"I'm looking for a project, maybe a derelict barn or an old pub with planning permission.",search_properties
Search for homes with good transport links to central London.,search_properties
Display the gallery for the new build in Milton Keynes.,get_property_details
Are there any homes for sale that include a separate guest cottage?,search_properties
Show me all 'Price on Application' listings in Chelsea.,search_properties
Generate an article on the price per square foot: A comparison across different London boroughs.,generate_blog_post
Write a blog post about the rise of 'green' homes and their impact on property values.,generate_blog_post
Generate a listing for a historic brownstone in Brooklyn's Park Slope neighborhood.,generate_property_description
Create an article on 'The Art of Depersonalisation: Preparing Your Home for Sale'.,generate_blog_post
Find the memorandum of sale for the house on Portobello Road.,get_property_details
Compose a guide for selling a tenanted property.,generate_blog_post
"The sale didn't go through for the Birmingham property, please make it available again.",update_listing
"Generate a description for a house that's a 'blank canvas', perfect for renovation.",generate_property_description
Write a guide to understanding the 'chain' in a property transaction.,generate_blog_post
Show me everything listed in the last 48 hours in the E1 postcode.,search_properties
Create a blog post on portfolio diversification strategies for property investors.,generate_blog_post
Write up a listing for me. It's a 3-bed semi-detached in a Cardiff suburb with a garage and driveway.,generate_property_description
"The landlord wants to increase the rent on the Islington flat to £2,100 PCM after the refurb.",update_listing
"Remove the photo of the second bedroom for the London flat, it's being redecorated.",update_listing
Find me a house that needs modernisation in the suburbs of Glasgow.,search_properties
"Update the listing for the Southampton property to 'Guide Price £400,000 - £425,000'.",update_listing
Show me the local school catchment area for the house in Richmond.,get_property_details
Draft an article on the tax benefits of using a limited company for buy-to-let properties.,generate_blog_post
Draft a listing for a charming apartment with a balcony in the Trastevere neighborhood of Rome.,generate_property_description
Write a blog post that demystifies the conveyancing process.,generate_blog_post
"Mark the rental on Park Road, Bristol as 'Let Subject to Referencing'.",update_listing
Find a family home close to Heaton Park in Manchester.,search_properties
Show me properties with a large garden in the Surrey Hills.,search_properties
Create an article on the importance of conducting regular property inspections.,generate_blog_post
Collate all the negative viewing comments for the property in Maida Vale.,get_property_details
Create an article titled: 'Will the General Election Results Impact UK House Prices?',generate_blog_post
Show me a three-bedroom house with a garage and a driveway in a good Bristol school catchment.,search_properties
Show me all the listings on Zoopla in the SK9 postcode.,search_properties
Search for eco-homes or properties with solar panels in Brighton.,search_properties
Pull up the marketing text used for the property description.,get_property_details
What is the current status of the sale for the home in St Albans?,get_property_details
Pull up the offer history for the apartment with ID 789-CDE.,get_property_details
"What's available in the Jewellery Quarter, Birmingham, with secure parking?",search_properties
Cancel the open house scheduled for this weekend for the property in Richmond.,update_listing
"I'm looking for a large, detached family home in Solihull.",search_properties
Show me the floor plan for the house on Ocean View Drive.,get_property_details
Update the deposit for the Shoreditch flat to be '5 weeks' rent'.,update_listing
The property is Grade II listed; this needs to be prominently mentioned in the first paragraph of the description.,update_listing
Write an article on how the 'Bank of Mum and Dad' is shaping the first-time buyer market.,generate_blog_post
Create a description for a ground-floor flat with direct garden access in Glasgow's West End.,generate_property_description
"The ground rent for the flat in Putney is zero, please update the details.",update_listing
"Just listed a property in Jesmond, Newcastle. It's a 3-bedroom upper maisonette and needs a great description.",generate_property_description
Can you add to the description for the Wimbledon house that it's in the catchment area for Pelham Primary School?,update_listing
Display the listing timeline for the house on Church Road.,get_property_details
Create a description that highlights the significant built-in storage in a 2-bed London flat.,generate_property_description
Generate a blog post on simple ways to create a welcoming and memorable entrance hall.,generate_blog_post
Generate a post on 'How to Handle End-of-Tenancy Deposit Disputes Fairly and Legally'.,generate_blog_post
Search for a detached bungalow on a single level with no steps in Devon.,search_properties
Compose a piece on whether renting is becoming more financially sensible than buying in 2026.,generate_blog_post
I need a description for a portfolio of 10 tenanted properties being sold by an investor.,generate_property_description
"Please compose a description for a 4-bed family home in a suburb of Toronto, Canada.",generate_property_description
"Give me a description for a ski chalet in the French Alps, focusing on its ski-in/ski-out access.",generate_property_description
Update the rental property in Birmingham: 'Available immediately'.,update_listing
Are there any flats with a 24-hour concierge in Manchester's Deansgate?,search_properties
"The sellers of the cottage in the Cotswolds want to test the market higher, increase the price by £15,000.",update_listing
Can you update the property type from 'Terraced' to 'End of Terrace' for the listing in Sheffield?,update_listing
Write a blog post on 'The Best Family-Friendly Neighbourhoods in Surrey'.,generate_blog_post
Are there any Grade II listed properties for sale in Bath?,search_properties
"Remove the winter shots and add the new summer photos for the property on The Green, Richmond.",update_listing
"Increase the asking price for the mansion in Chelsea to £5,500,000.",update_listing
Update the rent for the room in the shared house to '£750 PCM including bills'.,update_listing
